course,type,code,description
computinglaw,core,23401,"This course serves as an introduction to the theory of discrete mathematics, which lays the foundation for computer science courses such as data structures, algorithms, relational database theory and cryptography. The topics covered in this course are mathematical logic, elementary number theory, recursion, set theory, functions, combinatorics and graphs. The course will consist of lectures and tutorials to help students understand the covered topics. Course Learning Outcomes 1. Express a logic statement in terms of predicates, quantifiers and logical connectives. 2. Prove a statement using direct/indirect approaches. 3. Apply elementary number theory to proof problems on divisibility and prime numbers. 4. Use mathematical inductions to prove sequence expressions. 5. Identify the differences between weak and strong induction. 6. Solve elementary set problems with setalgebraion: Restricted 7. Distinguish functions which are injective and/or surjective. 8. Solve problems which involve composite functions. 9. Employ the principle of inclusion/exclusion rule and pigeonhole principle to solve combinatorial problems. 10. Solve discrete probability problems. 11. Use binomial theorem to solve sequence problems. 12. Understand the basic concepts of trees and graphs. Grading Basis GRD - Graded Course Units 1"
computinglaw,core,1551,"This course prepares students to design, deploy, and manage the interconnection of networking devices, including cyber-physical systems. It covers fundamental computer communication concepts, including switching, signalling, encoding and transmission, modern network technology, protocols (TCP, UDP, IP), and wireless (cellular and wireless LAN). Besides helping students to understand the key technologies conceptually, the course is structured to develop students’ skills in building, analyzing, and evaluation simple communication networks. Course Learning Outcomes 1. Understand metrics for network performance, and layered network model 2. Understand HTTP protocol and DNS protocols 3. Understand principles of reliable data transfer 4. Understand UDP and TCP protocols 5. Understand IP addressing, NAT and IPV6 6. Understand link state and distance vector routing algorithms 7. Understand OSFP and BGP routing protocols 8. Understand data link layer protocols 9. Conduct network measurements with basic network tools Grading Basis GRD - Graded Course Units 1"
computinglaw,core,23411,"The IT Solution Architecture course integrates design concepts and methods to develop IT solutions from both the software and system-level perspectives. It focuses on the analysis, design and implementation of an IT solution through which business requirements, software qualities and solution elements are transformed into implementable artefacts. By combining critical analysis with hands-on design and development, the course prepares students to participate effectively in the architecture design and development stages of a software-intensive IT solution project. It is highly recommended that students are also proficient in IS442 Object Oriented Programming and Java programming language prior to reading this course. Course Learning Outcomes 1. Understand the importance of software architecture for an IT Solution. 2. Understand the essentials of operating systems and networking for architecture design. 3. Describe your IT architecture using views and software qualities. 4. Understand and apply software design and integration patterns. 5. Understand and apply architectural styles and development strategy 6. Design and develop an IT software solution design, 7. Analyse and evaluate your IT solution design for maintainability quality. 8. Analyse and evaluate your IT solution design for availability quality. 9. Analyse and evaluate your IT solution design for security quality. 10. Analyse and evaluate your IT solution design for performance quality. Grading Basis GRD - Graded Course Units 1"
computinglaw,core,1531,"This course will cover fundamentals of relational database theory, important data management concepts such as data modelling, database design, database implementation in current business information systems, and some basic concepts related to unstructured data.A series of in-class exercises, tests, pop quizzes and a course project will help students understand the covered topics. Students are expected to apply knowledge learned in the classroom to solve many problems based on real-life business scenarios, while gaining hands-on experience in designing, implementing, and managing database systems. Students are also expected to understand the differences between structured data and unstructured data.This course is applicable to students declaring a major from SIS. Course Learning Outcomes 1) Explain the concepts of Entity-Relationship (ER) Model 2) Explain the concepts of Enhanced Entity-Relationship (EER) Model 3) Develop an EER model for a given application to support a given list of functions 4) Explain the concepts of relations and the seven steps required to transform a given ER/EER model to a relational schema 5) Apply the transformation from ER/EER models to relations in many scenarios 6) Explain the concepts of data normalization and the first three normal forms 7) Apply data normalization in many scenarios 8) Explain the Structured Query Language (SQL) 9) Demonstrate how to build a database and how to retrieve data from the database via MySQL 10) Build a database for a given scenario and write SQL statements to retrieve data from it 11) Explain the concepts of unstructured data and similarity search in text Grading Basis GRD - Graded Course Units 1"
computinglaw,core,10941,"This course introduces fundamental human-computer interaction principles and techniques for designing usable interactive systems. Topics include common methods for gathering user requirements, basic UI and graphics programming techniques, and common evaluation techniques. Hands-on experience with UI prototyping tools will be provided and students will complete a UI design and prototyping project as part of this course. Course Learning Outcomes 1. Choose an appropriate observation strategy given a set of constraints. 2. Choose appropriate participants for observational studies or user studies. 3. Analyse users' existing work processes and identify breakdowns that indicate the need for a new interaction design. 4. Classify problems with conceptual models given a record of user behaviour. 5. Recall the key benefits and drawbacks of using metaphors in interaction design. 6. Choose an appropriate prototyping strategy given a set of constraints. 7. Create hand-drawn paper prototypes of an interaction design. 8. Choose an appropriate evaluation technique given a set of constraints. 9. Design an evaluation strategy for an interaction design project. 10. Evaluate a user interface design given a set of heuristics and propose solutions to any problems identified. 11. Choose between a within-subjects or a between-subjects experimental design given a set of constraints. 12. Classify possible experimental variables as independent, dependent, confounding, or non-variables. 13. Identify threats to internal and external validity in experimental design. 14. Perform a statistical analysis of quantitative experimental data. Grading Basis GRD - Graded Course Units 1"
computinglaw,core,6121,"In every trial, the trial judge is faced with two distinct challenges. First, the trial judge must make findings of fact, which is to say, the judge has to decide what happened. Secondly, based on these facts, the trial judge applies the relevant substantive legal rules to the dispute before coming to his reasoned decision. The Law of Evidence is concerned with the rules, theories and policies underlying the heavy responsibility of the trial judge in relation to the first question. This area of the law is concerned with the issues of admissibility of evidence, modes of proof, the manner of production of evidence, and the standard and burden of proof. In the final part of this course, the students will also be acquainted with civil procedure. Grading Basis GRD - Graded Course Units 1.5"
computinglaw,core,5961,"Contracts are the foundation of commercial life. This course aims to equip students with a firm appreciation of the unique character of contracts as a form of voluntary undertakings. This course begins by examining the concepts relating to the formation of contract, as well as how an otherwise validly formed contract may have its effect nullified by issues such as misrepresentation, duress, undue influence, etc. Contract Law 1 will be followed in the second semester by LAW102 Contract Law 2 which will go on to look at issues relating to how a contract may be discharged, what sort of remedies are available when a contractual obligation is breached, as well as certain issues relating to contracts for the sale of goods. Over the two courses, the student will be sensitized to the role of the law in facilitating commerce, respecting legitimate expectations, and guarding against unfair exploitation of economic or social weakness. The study of the subject will also provide students with an excellent opportunity to observe, evaluate and critique developments in the law as it responds to the fast-changing and dynamic environment of the world of commerce. Course Learning Outcomes By the end of the course, students should be able to understand the basic legal concepts relating to the formation of contracts, the contents of a contract, and the discharge of a contract, as well as their application to factual scenarios. Grading Basis GRD - Graded Course Units 1"
computinglaw,core,5971,"This course builds on the foundational knowledge in LAW101 Contract Law 1 and aims to equip students with a firm appreciation of the unique character of contracts as a form of voluntary undertaking. By examining the concepts relating to mistake, misrepresentation, non-disclosure, duress, undue influence, unconscionability, illegality, formalities, capacity, privity, and remedies for breach of contract, the student will be sensitized to the role of the law in facilitating commerce, respecting legitimate expectations, and guarding against unfair exploitation of economic or social weakness, in the context of paper-based as well as electronic commerce contracts. It will, in particular, introduce students to the use of technology which impacts business and consumer contracts, and the applicability of contract law rules in such situations. The study of the subject will provide students with an excellent opportunity to observe, evaluate and critique developments in the law in response to the dynamic environment of commerce. Course Learning Outcomes By the end of the course, students should be able to understand the legal issues relating to the vitiation of contracts, privity of contract, as well as the web of remedies that become available when a contractual obligation is breached. Grading Basis GRD - Graded Course Units 1"
computinglaw,core,5981,"This course will introduce students to the basic principles and various aspects of criminal law. The criminal law in Singapore is contained in the Penal Code (Cap. 224) and provisions in other statutes. Case law interpreting and applying the elements and provisions of the various offences will also be examined. The student will first approach criminal law from a jurisprudential viewpoint and consider its objectives, functions and theoretical basis. A greater part of the course will be spent examining the various substantive areas of criminal law. Course Learning Outcomes 1. Understand the fundamental principles of criminal liability; 2. Apply these principles to scenarios encountered in criminal practice; 3. Critique the criminal law from both a policy and theoretical perspective; 4. Evaluate proposals for law reform. Analyse a statute into its constituent elements; Understand the basic principles that underpin strict liability offences, offences involving negligence and rashness, offences involving knowledge and intentional offences; Apply the principles to a realistic scenario; Give a reasoned recommendation regarding whether to prosecute and, if so, what sentences to ask for; Provide legal advice to a client who may actually or potentially be charged with an offence. Grading Basis GRD - Graded Course Units 1.25"
computinglaw,core,6001,"This course will discuss general principles of tort law as well as covering a selected number of torts in greater depth. The goals and objectives of tort law will be examined in the context of the relationship between torts, contract, criminal law and property law. There will be emphasis placed on the different range of interests protected by torts (property, economic, personal etc) and the need to achieve a proper balance between competing interests. Different classification systems for torts will be examined: by interest, by the nature of the interference (intention, recklessness, carelessness, strict liability) and by whether consequential harm is needed (torts actionable per se). One goal will be to demonstrate the dynamic nature of law and its development to meet changing social and economic conditions. Before an examination of the various torts, the students will learn about the internal classification of torts and the relationship of the law of torts to other legal obligations. Course Learning Outcomes By the end of the course, students should have a (1) good understanding of the overall framework of tort law, (2) understand the key objectives, (3) have a good grasp of the major torts and their critical concepts and controversies, (4) where there is imperfection in the law, analyse suggest what the desired legal position should be, (5) apply their knowledge to scenarios presented to them. Grading Basis GRD - Graded Course Units 1.5"
computinglaw,core,6011,"The objective of this course is to develop skills in practical legal research, writing and drafting, interviewing and advising and advocacy in first-year students. These skills will be taught in the context of legal problems in contract law, criminal law, and the law of torts, previously covered or concurrently taught in the first year. Course Learning Outcomes (i) conduct legal research effectively and accurately, including identifying the key issues involved (ii) analyse and apply the relevant law to various scenarios; and (iii) apply their legal knowledge to complex situations using logic and legal reasoning; (iv) recognise possible alternative conclusions and provide supporting reasons for those conclusions; (v) use the English language and legal terminology with care, precision and accuracy, to effectively communicate their analysis to different audiences, both in writing and orally. Grading Basis GRD - Graded Course Units 1"
computinglaw,core,21591,"The objective of this course is to develop skills in practical legal research, writing and drafting, interviewing and advising and advocacy in first-year students. These skills will be taught in the context of legal problems in contract law, criminal law, and the law of torts, previously covered or concurrently taught in the first year. Course Learning Outcomes (i) craft persuasive arguments; (ii) write an appellate memorandum; and (ii) apply their legal knowledge to complex situations using logic and legal reasoning; (iv) use the English language and legal terminology with care, precision, and accuracy Grading Basis GRD - Graded Course Units 0.5"
computinglaw,core,21601,"Singapore belongs to the common law tradition, given its English colonial heritage. Many aspects of the legal system are thus derived from the English system. It is important to realise, though, that Singapore’s legal system and that of its constituent laws are not mere offshoots of the English. Many substantive and institutional features as well as rules and practices within the system have changed over time. Broadly speaking, topics include Singapore’s legal history, the sources of law in Singapore, constitutional and institutional framework of the Singapore State, disruptions to and the regulation of the legal sector. Time permitting, a trip to a State institution may be organised. The main objectives of the course are, firstly, to familiarise students to various key aspects of the Singapore legal system; and, secondly, to equip candidates with a set of fundamental legal knowledge to springboard to other courses within the core curriculum. Course Learning Outcomes list various areas of law in Singapore describe the key institutions in Singapore's legal system, including: o what their functions are o who staffs them o how its members are appointed/elected, and how they may be removed o their key characteristics, and how those characteristics make them suited to their respective functions describe the various roles in the legal profession distinguish between the various sources of law in Singapore, including: o who makes them o when they are made o how they may be modified o how different sources of law relate to each other understand the ethical norms relating to the study and practice of law, including: o give a brief account of the ethical norms relating to the various roles in the legal profession o state and practise the ethical norms which they are required to follow as students of the law develop good habits relating to learning the law, including: o using primary legal materials for authoritative statements of the law o relating different areas of knowledge to each other o paying close attention to the precise content of the law o inquiring into the sources of, and limits to, power o identifying and seeking to clarify doubts Grading Basis PNP - Pass/Fail Course Units 0.5"
computinglaw,core,28651,"This course will examine the various legal cultures and traditions within Asia. The historical background of these traditions in Asia including the Western and colonialist (and post-colonialist) influences will also be explored. In this increasingly globalised economy, the lawyer needs to be conversant with the legal traditions and cultures of Asia especially that of Southeast Asia, India and China. Course Learning Outcomes Establish a firm foundation in the major methodological concepts and intellectual discourse related to conducting comparisons; Develop a critical awareness of the core features of the civil law tradition and its relationship to the common law traditi; Understand the choices that have been made by Asian legal systems in devising the fundamentals of their legal systems; Appreciate the role and relevance of comparative legal research in the making of a transnational body of rules. Grading Basis GRD - Graded Course Units 0.5"
computinglaw,core,6021,"Under Singapore law, there are different ways in which businesspeople may organise commercial activities with a view to maximising operational efficiency and minimising exposure to personal risk. Most, however, will opt to incorporate a company for the purpose. This is however no indication that the company is a simple structure. On the contrary, as the company is effectively a web of different interests, rights and obligations, it is a highly complex structure. As such, the corporate form is fittingly the most regulated of all business entities. In this course, we will examine how a company is formed, the consequences of incorporation, how it is managed and controlled, what responsibilities are visited upon those who exercise control over a company’s assets, how a company transacts with third parties, and how it raises capital. The course will also expose the student to issues relating to shareholder rights and to creditor protection mechanisms. In addition, the student will be introduced to corporate rescue and insolvency laws, as well as to corporate finance. Course Learning Outcomes Appreciate and understand the legal rules and principles that govern companies in Singapore; Understand the life-cycle of a company Identify the different categories of stakeholders in companies and; appreciate their respective interests; Identify and apply the relevant statutes in conjunction with common law principles to the common issues that affect the governance of companies generally. Grading Basis GRD - Graded Course Units 1.5"
computinglaw,core,6031,"This course aims to introduce students to the basic principles of common law and equity as applied to property, both immoveable and moveable including intellectual property. Beginning with an exploration of what ownership of land means, this course will consider how land can be dealt with at common law and in equity, before taking a look at how some of these complexities have receded, given the adoption and universal application of the Torrens registration system in Singapore. In the middle part of this course, the question of ownership and transfer of moveable property at common law and in equity will be considered with particular attention to the difficulties posed by intangible moveable property in the form of intellectual property rights as well as other choices in action. The final part of the course examines the creation of security interests over immoveable and moveable property and the problems relating to determining the priorities of competing security interests. Comparisons may be drawn with alternative systems of property law, e.g. the scheme of security interests set out in the Uniform Commercial Code and the treatment of property generally in the American Restatement on Property. Course Learning Outcomes 1. Understand the basic principles of common law and equity as applied to property 2. Analyze the creation and management of property interests 3. Evaluate the Torrens system of land registration in Singapore 4. Connect legal concepts with modern commercial practices Grading Basis GRD - Graded Course Units 1.25"
computinglaw,core,6041,"This course will examine the various legal cultures and traditions within Asia. The historical background of these traditions in Asia including the Western and colonialist (and post-colonialist) influences will also be explored. In this increasingly globalised economy, the lawyer needs to be conversant with the legal traditions and cultures of Asia especially that of Southeast Asia, India and China. Grading Basis GRD - Graded Course Units 1"
computinglaw,core,6051,"This course introduces the principles of constitutional law and administrative law. Constitutional law is concerned with the organisation of the state, the inter-relationship between the government, civil society, and the individual. Administrative law is about the governance of public bodies exercising statutory or other powers or performing public duties. This course is generally concerned with how law, institutions and norms promote good governance, how political power and public law functions are legitimated, how abuses of public power are prevented or remedied, and the relationship between the individual and the state. Course Learning Outcomes In this course, we will be concerned with (1) how law, institutions and norms promote good governance, (2) how political power and public law functions are legitimated, (3) how abuses of public power are prevented or remedied, and (4) how to understand the proper relationship between the individual and the state. By the end of this course, students should appreciate the significance of these questions, understand the important debates about them and their greater significance for the legal system, and be able to apply their knowledge to address practical problems arising from these topics. Besides being an exercise in critical thinking and understanding, the course will add to students inventory of skills needed to practise law. Grading Basis GRD - Graded Course Units 1.5"
computinglaw,core,6071,"The course aims to provide an introduction to the underlying philosophies and theories for the existence of a legal system and its laws, the interaction between Law and other disciplines such as Ethics, Society and Business, the different perspectives and approaches to the Law as well as specific topics on Asian Values and Adjudication. The application of the various jurisprudential theories will be illustrated through local legislation such as the Women’s Charter. Course Learning Outcomes By pushing the boundaries of law which have possibly been constructed by legal education and conventional discourse, this course encourages students to (1) critically reflect upon foundational ideals of law. (2) It challenges students to develop and formulate their own theses about law and justice, (4) discover and relate their personal visions to their professional identities,(5) and meaningfully understand their roles and purpose as lawyers and/or active citizenry in the legal process. Grading Basis GRD - Graded Course Units 1"
