course,type,code,description
accountancy,elective,121,"This course aims at providing students with an understanding of topical issues in Management accounting in an organizational setting. This course will examine the use of different value creating management accounting and strategic tools in both the manufacturing and service industries. Topics cover strategy, culture, sustainability and its reporting, group setup for transfer price planning, and selective advanced controlling tools. Standard Learning Outcomes (School of Accountancy courses only) LO1.1: Our students can recognize, develop, measure, record, validate and communicate financial and other related information. LO1.2: Our students can analyze, synthesize and evaluate financial and other related information for decision making in a management context. LO2.1: Our students understand and can apply business concepts and principles. LO2.2: Our students can communicate effectively in a business context. LO2.3: Our students understand the principles of leadership and team building in a business context. LO3.1: Our students understand and can apply the ethical principles relevant to accounting professionals. LO3.2: Our students can recognize and incorporate ethical and social responsibility considerations in decision making. Course Learning Outcomes At the end of this course, students will be able to: Grading Basis GRD - Graded Course Units 1"
accountancy,elective,151,"The aim of this course is to help students in their practical application of taxation law and principles, which they learned in an earlier course. It also aims to increase their knowledge and understanding of the taxation issues commonly raised by businesses and individuals. On completion of this course, the students should have a better understanding of the main taxation issues related to individuals and businesses; and apply the main taxation principles to real life. Standard Learning Outcomes (School of Accountancy courses only) LO1.1: Our students can recognize, develop, measure, record, validate and communicate financial and other related information. LO1.2: Our students can analyze, synthesize and evaluate financial and other related information for decision making in a management context. LO1.4: Our students understand and can apply tax principles and requirements relevant to individuals and business entities. LO2.1: Our students understand and can apply business concepts and principles. LO2.2: Our students can communicate effectively in a business context. LO3.1: Our students understand and can apply the ethical principles relevant to accounting professionals. LO3.2: Our students can recognize and incorporate ethical and social responsibility considerations in decision making. Grading Basis GRD - Graded Course Units 1"
accountancy,elective,13501,"This course aims to provide knowledge of the activities involved in the day-to-day running of a corporation’s financial operations as well as advanced analytical techniques which can help create value to companies and organizations. It aims to develop students’ ability to use the techniques involved in analyzing and evaluating corporate managerial problems and making sound decisions. It is excellent for students who are less keen on auditing and would like to pursue a career in the financial area of a corporation or a career with banks and other financial institutions servicing the needs of a corporate client. It will also be a great foundation for students who want to embark on a senior general management career from a finance specialization. Standard Learning Outcomes (School of Accountancy courses only) LO1.1: Our students can recognize, develop, measure, record, validate and communicate financial and other related information. LO1.2: Our students can analyze, synthesize and evaluate financial and other related information for decision making in a management context. LO1.3: Our students understand and can apply concepts relating to business processes, audit and assurance. LO2.1: Our students understand and can apply business concepts and principles. LO2.2: Our students can communicate effectively in a business context. LO2.3: Our students understand the principles of leadership and team building in a business context. LO2.4: Our students can use Information Technology tools to analyse financial and other related information as well as communicate this to relevant stakeholders within a business context. LO3.1: Our students understand and can apply the ethical principles relevant to accounting professionals. LO3.2: Our students can recognize and incorporate ethical and social responsibility considerations in decision making. Grading Basis GRD - Graded Course Units 1"
accountancy,elective,13531,"This course imparts knowledge of, and foundational skills in, the practice of public sector auditing. It begins with the teaching of management concepts and practices, in particular organizational processes, management control and action accountability. With this grounding provided, the course moves on to cover the auditing of the management and use of public funds by organizations and in programs for the public good. Focus will be placed on the analyzing and interpreting of audit observations, the making of audit judgments and the communication of audit findings. Case studies will be used and reading materials recommended. The course will culminate in a project assignment for individual students. Standard Learning Outcomes (School of Accountancy courses only) LO1.3: Our students understand and can apply concepts relating to business processes, audit and assurance. Grading Basis GRD - Graded Course Units 1"
accountancy,elective,13541,"Today’s business environment is characterized by growing uncertainties and increasing stakeholders’ demands for more effective governance in the wake of spectacular corporate failures. Internal audit is an important mechanism in providing internal assurance on the tenacity of governance and risk management practices. Its significance is re-inforced in the recommendations by the Committee to Develop the Accountancy Sector (CDAS) in 2010. The CDAS’ report, titled “Transforming Singapore into a Leading Global Accountancy Hub” identified and recommended internal audit as a niche pathway toward accountancy excellence for Singapore. Internal audit is an essential pillar of a resilient organization. This course provides participants with a sound foundation of internal concepts and practices. It provides an overview of internal audit in support on sound governance and risk management. The course content covers essential standards and guidance articulated by the Institute of Internal Auditors. These include the attributes of internal audit, planning, execution and internal audit reporting. The course also aims to enhance participants’ understanding and application of assurance methodologies that are crucial in building a culture of doing the right thing. Standard Learning Outcomes (School of Accountancy courses only) LO1.3: Our students understand and can apply concepts relating to business processes, audit and assurance. LO2.1: Our students understand and can apply business concepts and principles. Grading Basis GRD - Graded Course Units 1"
accountancy,elective,19901,"The course expands on ACCT331 and covers advanced auditing and assurance topics. On Auditing, the scope includes Group Audit and IT Auditing. Besides Auditing, Assurance and advisory engagements are an integral part of professional services in practice. This course covers assurance in relation sustainability reports, prospective financial information and reliability of internal controls. In addition, it explore special topics such as due diligence in Merger and Acquisition, fraud investigation and internal audit. Standard Learning Outcomes (School of Accountancy courses only) LO1.3: Our students understand and can apply concepts relating to business processes, audit and assurance. LO2.1: Our students understand and can apply business concepts and principles. Grading Basis GRD - Graded Course Units 1"
accountancy,elective,20371,"This course provides knowledge on the full spectrum of the restructuring and insolvency regimes available in Singapore and the application of these regimes in situations of various degrees of distress. Insolvency practice includes practicing as a “company doctor” overseeing formal and informal workouts for financially distressed business or practicing as a company receiver, administrator and liquidator with the objective of maximizing recovery to creditors. Students will learn the different types of restructuring and insolvency procedures most suited to each situation, the legal implications and effects on the business entities and various stakeholders, the roles, responsibilities and powers of insolvency practitioners under each procedure, and the practical / commercial issues to consider when business entities enter into the restructuring or insolvency mode. This course aims to equip students with the basic knowledge in detecting the early warning signs, understanding financial issues faced by business entities and financial impact of key decisions in addressing the situation. It also emphasizes the practical application of theories and concepts learnt in class to the real worldThe course is not only designed to be relevant for students who are specifically seeking a career in insolvency practice but also for those who are interested in business rescue and business failure generally. Standard Learning Outcomes (School of Accountancy courses only) LO1.1: Our students can recognize, develop, measure, record, validate and communicate financial and other related information. LO1.2: Our students can analyze, synthesize and evaluate financial and other related information for decision making in a management context. LO1.3: Our students understand and can apply concepts relating to business processes, audit and assurance. LO2.1: Our students understand and can apply business concepts and principles. Course Learning Outcomes At the end of this course, students will be able to: Grading Basis GRD - Graded Course Units 1"
accountancy,elective,21091,"Accountants regularly work with large amounts of financial and non-financial data. Data modelling is an important means through which accountants can analyse such data for trends, patterns, relationships, and other useful information for decision making. This course will introduce a variety of quantitative techniques used in the development, implementation, and utilization of analytical data models that accountants regularly use in decision making. It will cover techniques including regression analysis, trend analysis, optimization, text analytics, and simulation. Visualization provides an important means through which accountants can communicate insights obtained via data modelling to their intended recipients. Well-designed visualisations can improve the memory, comprehension, and decision making of intended recipients of this information. This course will introduce students to key principles and techniques for data visualization. Students will create visuals including dashboards and interactive visualisations for decision making in the accounting context. Standard Learning Outcomes (School of Accountancy courses only) LO1.1: Our students can recognize, develop, measure, record, validate and communicate financial and other related information. LO1.2: Our students can analyze, synthesize and evaluate financial and other related information for decision making in a management context. LO1.3: Our students understand and can apply concepts relating to business processes, audit and assurance. LO2.2: Our students can communicate effectively in a business context. Grading Basis GRD - Graded Course Units 1"
accountancy,elective,21071,"This course explores how data can be used to solve problems across financial accounting, managerial accounting, and audit contexts. Students will gain exposure to techniques to explore how financial and non-financial data is used to forecast events, detect financial discrepancies and frauds, predict corporate default, optimize operations, and determine business strategy. Some programming and data visualisation skills will be required to draw insights from large volumes of data. Advanced analytics methods such as text analytics, neural networks and deep learning will also be introduced. This course has been designed to equip students with an analytics mind-set to develop analytics strategies and make better business decisions. Standard Learning Outcomes (School of Accountancy courses only) LO1.1: Our students can recognize, develop, measure, record, validate and communicate financial and other related information. LO1.2: Our students can analyze, synthesize and evaluate financial and other related information for decision making in a management context. Grading Basis GRD - Graded Course Units 1"
accountancy,elective,21111,"This course examines quantitative models and techniques used by securities analysts and investment managers to identify and interpret patterns in accounting data for making value-based fundamental investing decisions. The course will discuss extant research evidence on value investing strategies over the past decades. Students will then learn to develop their own statistical models and algorithms, in the context of a value-based investing framework, to predict financial performance and distress risk of firms as well as to uncover securities that can potentially generate superior investment returns. The course will involve writing programming codes to analyze large-scale archival data, draw inferences from the statistical results, and back-test the models for their predictive power. The advantages as well as pitfalls of such statistical models—including issues of data selection, and behavioral and institutional biases—will also be examined. The skills taught in this course would be useful for students who wish to pursue a career in securities analysis, asset management, investment analytics or financial consulting. Standard Learning Outcomes (School of Accountancy courses only) LO1.2: Our students can analyze, synthesize and evaluate financial and other related information for decision making in a management context. LO2.1: Our students understand and can apply business concepts and principles. Grading Basis GRD - Graded Course Units 1"
accountancy,elective,21131,"With a rapidly changing regulatory environment, stakeholders are demanding more confidence and value from audit, particularly with the emergence of technologies such as data analytics. Data analytics is significantly changing the way auditors approach and conduct audit, where data is now brought to life to allow an in-depth risk assessment and more continuous real-time audit procedures to be performed – subjecting entire populations to audit procedures, not just samples. This course examines the application of data analytics in audit based on an underlying risk-based methodology with real-life examples. Students will also learn about practical aspects in the audit analytics process such as extraction, transformation and loading of data as well as the actual execution of audit analytics tests and visualisation of the results in software such as Tableau. By the end of the course, students, in their respective groups, are expected to conceptualise the application of audit analytics in real-life companies through development of prototype dashboards. Guidance from Deloitte audit partners will be provided through meetings with the students throughout the course. Standard Learning Outcomes (School of Accountancy courses only) LO1.1: Our students can recognize, develop, measure, record, validate and communicate financial and other related information. LO1.2: Our students can analyze, synthesize and evaluate financial and other related information for decision making in a management context. LO1.3: Our students understand and can apply concepts relating to business processes, audit and assurance. LO2.1: Our students understand and can apply business concepts and principles. LO2.2: Our students can communicate effectively in a business context. Grading Basis GRD - Graded Course Units 1"
accountancy,elective,21141,"This course examines IT systems and environment used to support the business processes common across various industries. The course helps to recognize how IT affects flows of business transactions, identify relevant technology elements, and assess risks arising from IT elements. Topics in the course will include the understanding, identifying and testing relevant to GITC (General IT Controls) and evaluate deficiencies in GITCs and assess the impact of GITC deficiencies on the audit. Moreover this course will also touch upon ways in which IT audit report documentation is done and audit observations are assessed, handled and addressed. Lastly the course will also give an overview of regulatory guidelines in place for technology risk management, outsourcing risk and business continuity management stipulated by Monetary Authority of Singapore (MAS). The course will use class activities, case study, real world examples and group discussions to increase the practicality of the knowledge content. Course is a perfect blend for individuals who are willing to learn about the IT elements considered in audit and compliance assessments. Standard Learning Outcomes (School of Accountancy courses only) LO1.1: Our students can recognize, develop, measure, record, validate and communicate financial and other related information. LO1.2: Our students can analyze, synthesize and evaluate financial and other related information for decision making in a management context. LO1.3: Our students understand and can apply concepts relating to business processes, audit and assurance. LO2.2: Our students can communicate effectively in a business context. LO2.3: Our students understand the principles of leadership and team building in a business context. LO3.1: Our students understand and can apply the ethical principles relevant to accounting professionals. Grading Basis GRD - Graded Course Units 1"
accountancy,elective,24681,"This course will equip students with the fundamental knowledge on how to investigate financial fraud. Students will not only learn the difference between accounting, auditing and forensics accounting, but towards the end of the course they will be able to apply proven methodologies to conduct financial fraud investigations. The module will begin with identifying what is fraud, the types of fraud schemes, evidence collections and the use of the ever important role of computer technology for forensic investigations. It will further develop and lay the foundations for forensics analytics, planning for an investigation, conducting interviews and reporting. At the end of the course, students will be ready to take up roles in the field of forensic accounting and investigations. Standard Learning Outcomes (School of Accountancy courses only) LO1.1: Our students can recognize, develop, measure, record, validate and communicate financial and other related information. LO1.2: Our students can analyze, synthesize and evaluate financial and other related information for decision making in a management context. LO2.1: Our students understand and can apply business concepts and principles. LO2.2: Our students can communicate effectively in a business context. LO2.3: Our students understand the principles of leadership and team building in a business context. LO3.1: Our students understand and can apply the ethical principles relevant to accounting professionals. LO3.2: Our students can recognize and incorporate ethical and social responsibility considerations in decision making. Grading Basis GRD - Graded Course Units 1"
accountancy,elective,25651,"This Cyber Risk and Forensic Work-Study Elective is a six-month internship attachment program at KPMG in Singapore under the SMU-KMPG Cyber Risk and Forensic Work-Study Elective Programme (WSEP). The WSEP is a collaboration between SMU and KPMG in Singapore that aims to train a next generation of cyber-criminal combatants to enter the fast-growing area of financial forensics and cyber forensics. This course offers students first hand exposure into the cyber world of forensics, cyber security and digital trust. They will be involved in teams performing • forensic investigations in both white-collar crimes as well as computer forensic investigations; • security reviews of systems in large organisations. These typically are extensions of a regulated entity’s financial audits and statements; and • IT audits for financial systems. Students will alternate between working four days at KPMG in Singapore, and studying on campus for two courses concurrently, for a period of six months. Students will be assigned to a SMU Faculty Advisor and a KPMG Internship Supervisor. Standard Learning Outcomes (School of Accountancy courses only) LO1.1: Our students can recognize, develop, measure, record, validate and communicate financial and other related information. LO1.2: Our students can analyze, synthesize and evaluate financial and other related information for decision making in a management context. LO2.1: Our students understand and can apply business concepts and principles. LO2.2: Our students can communicate effectively in a business context. LO2.3: Our students understand the principles of leadership and team building in a business context. LO2.4: Our students can use Information Technology tools to analyse financial and other related information as well as communicate this to relevant stakeholders within a business context. LO3.1: Our students understand and can apply the ethical principles relevant to accounting professionals. LO3.2: Our students can recognize and incorporate ethical and social responsibility considerations in decision making. Grading Basis PNP - Pass/Fail Course Units 2"
accountancy,elective,26381,"This Accounting Data and Analytics Work-Study Elective is a 20-week internship attachment program at a partner firm under the SMU Accounting Data and Analytics Work-Study Elective Programme. This course will engage students in active learning and applying knowledge that they have learned in the field. Students can expect to go through an immersive experience in one service area offered by a professional services firm, e.g. assurance, tax, advisory and consulting. Students will alternate between working four days at the partner firm, and studying on campus for two courses concurrently, during the internship period. Students will be assigned to a SMU Faculty Advisor and an Internship Supervisor. Standard Learning Outcomes (School of Accountancy courses only) LO1.1: Our students can recognize, develop, measure, record, validate and communicate financial and other related information. LO1.2: Our students can analyze, synthesize and evaluate financial and other related information for decision making in a management context. LO2.1: Our students understand and can apply business concepts and principles. LO2.2: Our students can communicate effectively in a business context. LO2.3: Our students understand the principles of leadership and team building in a business context. LO2.4: Our students can use Information Technology tools to analyse financial and other related information as well as communicate this to relevant stakeholders within a business context. LO3.1: Our students understand and can apply the ethical principles relevant to accounting professionals. LO3.2: Our students can recognize and incorporate ethical and social responsibility considerations in decision making. Grading Basis PNP - Pass/Fail Course Units 2"
